{
  "schemaVersion": 1,
  "id": "scylladb",
  "name": "ScyllaDB",
  "dbType": "SCYLLADB",
  "category": "WIDE_COLUMN",
  "vendor": "ScyllaDB, Inc.",
  "description": "CQL-compatible wide-column store, served by the very same AccessFlow Cassandra engine plugin. Installs on demand; row security only filters on partition/clustering key columns.",
  "documentationUrl": "https://docs.scylladb.com/",
  "logo": "logo.svg",
  "defaultPort": 9042,
  "defaultSslMode": "DISABLE",
  "bundled": false,
  "driver": {
    "type": "url",
    "url": "https://bablsoft.github.io/accessflow/engines/accessflow-engine-cassandra-1.0.2-all.jar",
    "fileName": "accessflow-engine-cassandra-1.0.2-all.jar",
    "sha256": "5ffb3c2ed81ff5609c838ed21ea049559786878385eb80ee67258102bbeeee3d"
  }
}
