{
  "schemaVersion": 1,
  "id": "mongodb",
  "name": "MongoDB",
  "dbType": "MONGODB",
  "category": "DOCUMENT",
  "vendor": "MongoDB, Inc.",
  "description": "The most popular open-source NoSQL document database. The AccessFlow MongoDB engine installs on demand.",
  "documentationUrl": "https://www.mongodb.com/docs/drivers/java/sync/current/",
  "logo": "logo.svg",
  "defaultPort": 27017,
  "defaultSslMode": "REQUIRE",
  "bundled": false,
  "driver": {
    "type": "url",
    "url": "https://bablsoft.github.io/accessflow/engines/accessflow-engine-mongodb-1.0.11-all.jar",
    "fileName": "accessflow-engine-mongodb-1.0.11-all.jar",
    "sha256": "d96c9362cc32b84945d68e654448ea6893d9957c1e917228105552f7c74abd7a"
  }
}
