{
  "schemaVersion": 1,
  "id": "redis",
  "name": "Redis",
  "dbType": "REDIS",
  "category": "KEY_VALUE",
  "vendor": "Redis Ltd.",
  "description": "The most popular open-source in-memory key-value store. The AccessFlow Redis engine installs on demand.",
  "documentationUrl": "https://redis.io/docs/latest/",
  "logo": "logo.svg",
  "defaultPort": 6379,
  "defaultSslMode": "DISABLE",
  "bundled": false,
  "driver": {
    "type": "url",
    "url": "https://bablsoft.github.io/accessflow/engines/accessflow-engine-redis-1.0.2-all.jar",
    "fileName": "accessflow-engine-redis-1.0.2-all.jar",
    "sha256": "a2b89a9578814a1503ab6786d98c7c798616358a16faf0ba9f3e813d3e5889d3"
  }
}
