{
  "schemaVersion": 1,
  "id": "cassandra",
  "name": "Apache Cassandra",
  "dbType": "CASSANDRA",
  "category": "WIDE_COLUMN",
  "vendor": "The Apache Software Foundation",
  "description": "Distributed NoSQL wide-column store queried with CQL. The AccessFlow Cassandra engine installs on demand; row security only filters on partition/clustering key columns.",
  "documentationUrl": "https://cassandra.apache.org/doc/latest/",
  "logo": "logo.svg",
  "defaultPort": 9042,
  "defaultSslMode": "DISABLE",
  "bundled": false,
  "driver": {
    "type": "url",
    "url": "https://bablsoft.github.io/accessflow/engines/accessflow-engine-cassandra-1.0.2-all.jar",
    "fileName": "accessflow-engine-cassandra-1.0.2-all.jar",
    "sha256": "5ffb3c2ed81ff5609c838ed21ea049559786878385eb80ee67258102bbeeee3d"
  }
}
