{
  "schemaVersion": 1,
  "id": "couchbase",
  "name": "Couchbase",
  "dbType": "COUCHBASE",
  "category": "DOCUMENT",
  "vendor": "Couchbase, Inc.",
  "description": "Distributed NoSQL document database queried with SQL++ (N1QL). The AccessFlow Couchbase engine installs on demand; TLS deployments bootstrap on port 11207 (couchbases://).",
  "documentationUrl": "https://docs.couchbase.com/java-sdk/current/hello-world/start-using-sdk.html",
  "logo": "logo.svg",
  "defaultPort": 11210,
  "defaultSslMode": "DISABLE",
  "bundled": false,
  "driver": {
    "type": "url",
    "url": "https://bablsoft.github.io/accessflow/engines/accessflow-engine-couchbase-1.0.9-all.jar",
    "fileName": "accessflow-engine-couchbase-1.0.9-all.jar",
    "sha256": "096ba04ff49b92d912b8af10a730f055343cd6e8453d1f2624c9a30f885fecff"
  }
}
